{"$ref":"#/definitions/catalog","$schema":"http://json-schema.org/draft-07/schema#","definitions":{"catalog":{"additionalProperties":false,"properties":{"attribution":{"items":{"additionalProperties":false,"properties":{"license":{"$ref":"#/definitions/catalog/properties/builder_version"},"source_id":{"$ref":"#/definitions/catalog/properties/builder_version"},"text":{"$ref":"#/definitions/catalog/properties/builder_version"},"url":{"format":"uri","type":"string"}},"required":["source_id","license","url","text"],"type":"object"},"type":"array"},"builder_version":{"minLength":1,"type":"string"},"corrections":{"items":{"additionalProperties":false,"properties":{"action":{"enum":["replace","withdraw","conflict"],"type":"string"},"evidence":{"$ref":"#/definitions/catalog/properties/builder_version"},"field":{"$ref":"#/definitions/catalog/properties/mappings/items/properties/fields/items"},"id":{"$ref":"#/definitions/catalog/properties/builder_version"},"identity":{"$ref":"#/definitions/catalog/properties/facts/items/properties/identity"},"reason":{"$ref":"#/definitions/catalog/properties/builder_version"},"reviewed_at":{"$ref":"#/definitions/catalog/properties/published_at"},"reviewed_by":{"$ref":"#/definitions/catalog/properties/builder_version"},"sequence":{"exclusiveMinimum":0,"type":"integer"},"value":{}},"required":["id","identity","field","action","reason","evidence","reviewed_by","reviewed_at","sequence"],"type":"object"},"type":"array"},"facts":{"items":{"additionalProperties":false,"properties":{"canonical_id":{"$ref":"#/definitions/catalog/properties/builder_version"},"capability":{"anyOf":[{"additionalProperties":false,"properties":{"data_as_of":{"anyOf":[{"$ref":"#/definitions/catalog/properties/published_at"},{"type":"null"}]},"evidence":{"$ref":"#/definitions/catalog/properties/builder_version"},"retrieved_at":{"$ref":"#/definitions/catalog/properties/published_at"},"source_id":{"$ref":"#/definitions/catalog/properties/builder_version"},"state":{"const":"known","type":"string"},"value":{"additionalProperties":false,"properties":{"inference_config":{"$ref":"#/definitions/catalog/properties/builder_version"},"model_snapshot":{"$ref":"#/definitions/catalog/properties/builder_version"},"profile_id":{"$ref":"#/definitions/catalog/properties/builder_version"},"score":{"type":"number"}},"required":["profile_id","score","model_snapshot","inference_config"],"type":"object"}},"required":["state","value","source_id","retrieved_at","data_as_of","evidence"],"type":"object"},{"additionalProperties":false,"properties":{"reason":{"$ref":"#/definitions/catalog/properties/builder_version"},"state":{"const":"unknown","type":"string"}},"required":["state","reason"],"type":"object"},{"additionalProperties":false,"properties":{"correction_id":{"$ref":"#/definitions/catalog/properties/builder_version"},"reason":{"$ref":"#/definitions/catalog/properties/builder_version"},"state":{"const":"withdrawn","type":"string"}},"required":["state","reason","correction_id"],"type":"object"},{"additionalProperties":false,"properties":{"reason":{"$ref":"#/definitions/catalog/properties/builder_version"},"state":{"const":"conflict","type":"string"}},"required":["state","reason"],"type":"object"}]},"display_name":{"$ref":"#/definitions/catalog/properties/builder_version"},"identity":{"additionalProperties":false,"properties":{"provider":{"$ref":"#/definitions/catalog/properties/builder_version"},"request_model_id":{"$ref":"#/definitions/catalog/properties/builder_version"},"scope":{"additionalProperties":false,"properties":{"plan":{"$ref":"#/definitions/catalog/properties/builder_version"},"protocol":{"$ref":"#/definitions/catalog/properties/builder_version"},"region":{"$ref":"#/definitions/catalog/properties/builder_version"},"route":{"$ref":"#/definitions/catalog/properties/builder_version"}},"required":["route","region","plan","protocol"],"type":"object"}},"required":["provider","request_model_id","scope"],"type":"object"},"popularity":{"anyOf":[{"additionalProperties":false,"properties":{"data_as_of":{"anyOf":[{"$ref":"#/definitions/catalog/properties/published_at"},{"type":"null"}]},"evidence":{"$ref":"#/definitions/catalog/properties/builder_version"},"retrieved_at":{"$ref":"#/definitions/catalog/properties/published_at"},"source_id":{"$ref":"#/definitions/catalog/properties/builder_version"},"state":{"const":"known","type":"string"},"value":{"additionalProperties":false,"properties":{"position":{"exclusiveMinimum":0,"type":"integer"},"ranking_eligible":{"type":"boolean"},"source_id":{"$ref":"#/definitions/catalog/properties/builder_version"},"source_model_id":{"$ref":"#/definitions/catalog/properties/builder_version"}},"required":["source_id","source_model_id","position","ranking_eligible"],"type":"object"}},"required":["state","value","source_id","retrieved_at","data_as_of","evidence"],"type":"object"},{"additionalProperties":false,"properties":{"reason":{"$ref":"#/definitions/catalog/properties/builder_version"},"state":{"const":"unknown","type":"string"}},"required":["state","reason"],"type":"object"},{"additionalProperties":false,"properties":{"correction_id":{"$ref":"#/definitions/catalog/properties/builder_version"},"reason":{"$ref":"#/definitions/catalog/properties/builder_version"},"state":{"const":"withdrawn","type":"string"}},"required":["state","reason","correction_id"],"type":"object"},{"additionalProperties":false,"properties":{"reason":{"$ref":"#/definitions/catalog/properties/builder_version"},"state":{"const":"conflict","type":"string"}},"required":["state","reason"],"type":"object"}]},"release":{"anyOf":[{"additionalProperties":false,"properties":{"data_as_of":{"anyOf":[{"$ref":"#/definitions/catalog/properties/published_at"},{"type":"null"}]},"evidence":{"$ref":"#/definitions/catalog/properties/builder_version"},"retrieved_at":{"$ref":"#/definitions/catalog/properties/published_at"},"source_id":{"$ref":"#/definitions/catalog/properties/builder_version"},"state":{"const":"known","type":"string"},"value":{"additionalProperties":false,"properties":{"date":{"$ref":"#/definitions/catalog/properties/builder_version"},"precision":{"enum":["day","month","year"],"type":"string"},"verified":{"type":"boolean"},"version_specific":{"type":"boolean"}},"required":["date","precision","verified","version_specific"],"type":"object"}},"required":["state","value","source_id","retrieved_at","data_as_of","evidence"],"type":"object"},{"additionalProperties":false,"properties":{"reason":{"$ref":"#/definitions/catalog/properties/builder_version"},"state":{"const":"unknown","type":"string"}},"required":["state","reason"],"type":"object"},{"additionalProperties":false,"properties":{"correction_id":{"$ref":"#/definitions/catalog/properties/builder_version"},"reason":{"$ref":"#/definitions/catalog/properties/builder_version"},"state":{"const":"withdrawn","type":"string"}},"required":["state","reason","correction_id"],"type":"object"},{"additionalProperties":false,"properties":{"reason":{"$ref":"#/definitions/catalog/properties/builder_version"},"state":{"const":"conflict","type":"string"}},"required":["state","reason"],"type":"object"}]}},"required":["identity","display_name","release","capability","popularity"],"type":"object"},"type":"array"},"fixture":{"type":"boolean"},"mappings":{"items":{"additionalProperties":false,"properties":{"canonical_id":{"$ref":"#/definitions/catalog/properties/builder_version"},"evidence":{"$ref":"#/definitions/catalog/properties/builder_version"},"fields":{"items":{"enum":["release","capability","popularity"],"type":"string"},"minItems":1,"type":"array"},"from":{"$ref":"#/definitions/catalog/properties/facts/items/properties/identity"},"id":{"$ref":"#/definitions/catalog/properties/builder_version"},"reviewed_at":{"$ref":"#/definitions/catalog/properties/published_at"},"reviewed_by":{"$ref":"#/definitions/catalog/properties/builder_version"},"status":{"enum":["approved","conflict","withdrawn"],"type":"string"},"to":{"$ref":"#/definitions/catalog/properties/facts/items/properties/identity"}},"required":["id","from","to","fields","evidence","reviewed_by","reviewed_at","status"],"type":"object"},"type":"array"},"metric_profiles":{"items":{"additionalProperties":false,"properties":{"direction":{"enum":["higher","lower"],"type":"string"},"evaluation_conditions":{"$ref":"#/definitions/catalog/properties/builder_version"},"id":{"$ref":"#/definitions/catalog/properties/builder_version"},"inference_config":{"$ref":"#/definitions/catalog/properties/builder_version"},"method_version":{"$ref":"#/definitions/catalog/properties/builder_version"},"metric":{"$ref":"#/definitions/catalog/properties/builder_version"},"model_snapshot":{"$ref":"#/definitions/catalog/properties/builder_version"},"name":{"$ref":"#/definitions/catalog/properties/builder_version"},"source_id":{"$ref":"#/definitions/catalog/properties/builder_version"},"task":{"$ref":"#/definitions/catalog/properties/builder_version"},"usage":{"$ref":"#/definitions/catalog/properties/source_revisions/items/properties/usage"}},"required":["id","source_id","name","metric","method_version","direction","task","model_snapshot","inference_config","evaluation_conditions","usage"],"type":"object"},"type":"array"},"module_compatibility":{"additionalProperties":false,"properties":{"min_consumer_version":{"pattern":"^\\d+\\.\\d+\\.\\d+$","type":"string"},"projection":{"const":1,"type":"number"}},"required":["projection","min_consumer_version"],"type":"object"},"publication_sequence":{"exclusiveMinimum":0,"maximum":9007199254740991,"type":"integer"},"published_at":{"format":"date-time","type":"string"},"revision":{"pattern":"^[a-f0-9]{64}$","type":"string"},"schema_version":{"const":1,"type":"number"},"source_revisions":{"items":{"additionalProperties":false,"properties":{"code_commit":{"pattern":"^[a-f0-9]{40,64}$","type":"string"},"complete":{"type":"boolean"},"data_as_of":{"anyOf":[{"$ref":"#/definitions/catalog/properties/published_at"},{"type":"null"}]},"error":{"$ref":"#/definitions/catalog/properties/builder_version"},"id":{"$ref":"#/definitions/catalog/properties/builder_version"},"retrieved_at":{"anyOf":[{"$ref":"#/definitions/catalog/properties/published_at"},{"type":"null"}]},"sha256":{"$ref":"#/definitions/catalog/properties/revision"},"status":{"enum":["success","not_modified","failed","partial","disabled"],"type":"string"},"url":{"format":"uri","type":"string"},"usage":{"additionalProperties":false,"properties":{"collection":{"enum":["allowed","unverified","disabled"],"type":"string"},"evidence":{"$ref":"#/definitions/catalog/properties/builder_version"},"redistribution":{"enum":["allowed","unverified","disabled"],"type":"string"}},"required":["collection","redistribution","evidence"],"type":"object"},"window":{"additionalProperties":false,"properties":{"end":{"anyOf":[{"$ref":"#/definitions/catalog/properties/published_at"},{"type":"null"}]},"start":{"anyOf":[{"$ref":"#/definitions/catalog/properties/published_at"},{"type":"null"}]}},"required":["start","end"],"type":"object"}},"required":["id","status","retrieved_at","data_as_of","window","usage","complete"],"type":"object"},"type":"array"}},"required":["schema_version","revision","builder_version","publication_sequence","published_at","source_revisions","metric_profiles","attribution","module_compatibility","facts","mappings","corrections","fixture"],"type":"object"}}}
