{"attribution":[{"license":"CC0-1.0","source_id":"fixture","text":"Synthetic tests","url":"https://example.invalid"}],"builder_version":"1.0.0","corrections":[],"facts":[{"capability":{"data_as_of":null,"evidence":"Synthetic test evidence, not production data","retrieved_at":"2026-10-25T00:00:00.000Z","source_id":"fixture","state":"known","value":{"inference_config":"reasoning=off","model_snapshot":"fixture-snapshot","profile_id":"fixture-profile","score":0}},"display_name":"Same display name","identity":{"provider":"provider-a","request_model_id":"fixture/v1","scope":{"plan":"public","protocol":"chat-completions","region":"global","route":"public"}},"popularity":{"data_as_of":null,"evidence":"Synthetic test evidence, not production data","retrieved_at":"2026-10-25T00:00:00.000Z","source_id":"fixture","state":"known","value":{"position":1,"ranking_eligible":true,"source_id":"fixture","source_model_id":"fixture-entry"}},"release":{"data_as_of":null,"evidence":"Synthetic test evidence, not production data","retrieved_at":"2026-10-25T00:00:00.000Z","source_id":"fixture","state":"known","value":{"date":"2026-10-01","precision":"day","verified":true,"version_specific":true}}}],"fixture":true,"mappings":[],"metric_profiles":[{"direction":"higher","evaluation_conditions":"No production claims","id":"fixture-profile","inference_config":"reasoning=off","method_version":"1","metric":"synthetic","model_snapshot":"fixture-snapshot","name":"Synthetic test profile","source_id":"fixture","task":"test only","usage":{"collection":"allowed","evidence":"Synthetic data","redistribution":"allowed"}}],"module_compatibility":{"min_consumer_version":"1.0.0","projection":1},"publication_sequence":1,"published_at":"2026-10-25T00:00:00.000Z","revision":"752a1f1eb377ff4217eea4dd5d258aba49a42a075936e9652560456bbd9dbacd","schema_version":1,"source_revisions":[{"complete":true,"data_as_of":null,"id":"fixture","retrieved_at":"2026-10-25T00:00:00.000Z","status":"success","usage":{"collection":"allowed","evidence":"Synthetic data","redistribution":"allowed"},"window":{"end":null,"start":null}}]}
